{
  "mode": "initial",
  "base_sha": "163f0e08",
  "head_sha": "5b0ce7ea",
  "verdict": "NOT_READY",
  "findings": [
    {
      "id": "REV-001",
      "title": "Archive validation and import can use different files",
      "locations": [
        {
          "path": "scripts/local/prebuild-release-images.sh",
          "start_line": 210,
          "end_line": 238
        }
      ],
      "scenario": "A concurrent process replaces the archive pathname after validation but before Docker reopens it for import.",
      "expected": "Docker imports the exact archive object that passed validation.",
      "actual": "Validation reads one file while Docker may reopen and import a different file at the same pathname.",
      "evidence_type": "contract_test",
      "evidence": "A focused fake-Docker barrier test replaces the archive after validation; the loader receives substituted bytes.",
      "impact": 4,
      "confidence": 98,
      "relationship": "introduced",
      "verification_status": "verified",
      "disposition": "BLOCK",
      "next_action": "Open once without following symlinks, validate that descriptor, and pass the same descriptor to Docker.",
      "retain_regression_test": true,
      "closure_condition": "The substitution test can no longer make imported bytes differ from validated bytes."
    }
  ],
  "summary": "One confirmed archive-identity blocker remains."
}
